{
  "for_micro_app_said": "EEgsJaYSB-07nBf_HieNDX-7c8A6D6RLDhYxe9UTEmAi",
  "ecosystem_affinity": [
    "insurance",
    "us-insurance-regulation",
    "carrier-onboarding"
  ],
  "convention_compliance": {
    "credential_naming": "compliant",
    "role_naming": "compliant",
    "workflow_naming": "deviation: 'license_application_carrier_side' uses descriptive snake_case rather than the recommended <Verb>By<Role> pattern (e.g., 'LicenseAppliedForByCarrier'). Recommended fix: rename to 'license_applied_for_by_carrier' on next minor version.",
    "exn_route_naming": "compliant",
    "lifecycle_state_naming": "compliant"
  },
  "semantic_lineage": [],
  "author_intent_notes": "Worked example produced via the micro-app-template-gen skill on 2026-05-11 as the capstone proof that spec + toolchain + skill are coherent end-to-end; migrated to CEL/1.0 on 2026-07-13 (Stage 3 of the expression-language migration, docs/superpowers/plans/2026-07-13-uel-cel-migration.md). Authoring scenario: startup carrier (no imported credentials initially) applies to a state regulator for an insurance license; pivotal event is 'an application has been submitted and adjudicated'. The carrier exports nothing in this micro-app — they only receive. The regulator's complementary side is the separate regulator-grants-carrier-license template.\n\nNote on credential imports: although the carrier starts with no active license instance, the schema requires that credential types referenced by reactions and workflows be declared in credentials.imports. The 'carrier_license' entry is therefore a type declaration, not an active-instance assertion. Its expected_schema_said is marked TBD pending alignment with the regulator's exported-credential schema.\n\nCEL/1.0 expressions are written against the bound-context cheat-sheet (references/cel-1.0-cheat-sheet.md). As part of the 2026-07-13 migration every expression in this template was compile-checked against cel-python 0.5.0 (the pinned CEL/1.0 runtime evaluator), and every test_vectors entry was executed through a reference fold engine implementing the accepted spec's reference semantics (ugard docs/superpowers/specs/2026-07-10-cel-declarative-aggregates-and-projections.md §11) — all vectors reproduce their declared expected state. Notable expression decisions:\n  - no_active_license_for_jurisdiction (state precondition) is rewritten from the earlier arrow-lambda .filter/.length idiom to CEL's .filter(x, ...)/size(...), and the stray command.payload.jurisdiction nesting is corrected to command.jurisdiction (state_precondition binds { state, command, principal } directly over the command's payload_schema fields — no .payload. nesting, per the cheat-sheet's bound-context table). The same bound-context fix applies to submit_application's aggregate_event payload_mapping: bare payload.jurisdiction/payload.lines_of_business references are corrected to command.* (command emissions bind { command, state }; there is no 'payload' variable in scope).\n  - All map literals in every expression use quoted string keys ({ \"jurisdiction\": command.jurisdiction }, never { jurisdiction: ... }): CEL map-literal keys are expressions, so a bare identifier key evaluates as an unbound variable — verified failure on cel-python 0.5.0.\n  - no_duplicate_active_license_per_jurisdiction (aggregate invariant) is rewritten from .every/.filter/.length to CEL's .all(x, ...)/.filter(x, ...)/size(...).\n  - license_terms_acceptable (workflow branch condition) is rewritten from the earlier arrow-lambda .every/.includes idiom to CEL's .all(l, ...) plus the 'in' membership operator (CEL has no .includes()/.contains() on lists; cheat-sheet §8 gotcha).\n  - The aggregate now carries an explicit fold handler map (template spec §6.5), replacing the earlier absent fold: application_submitted is an op-list append; license_granted and license_revoked are raw reducers because they touch two arrays at once (marking the matching application's status while adding/removing the corresponding active_licenses row) and the object-state op vocabulary (set/append/remove/increment/merge/move) has no single op for that. boundary.instance_key is a constant ('license_registry') because this aggregate is the carrier's own single private registry, not partitioned by any event field.\n  - my_active_licenses projection is migrated to shape: \"collection\" with primary_key: \"license_said\", an explicit fold handler map (upsert on grant, delete on revoke), and ordering: \"source_seq\" (single log). output_schema is renamed row_schema per the amended template spec.\n  - idempotency_key_expression is removed from submit_application: the field was dropped from the template spec during canon consolidation (THE DECISION §3.6 amendment 4; the runtime dedups on the exn message's SAID instead), and its old expression (hash(...)/.sort()/.join()) was not valid CEL regardless.\n\nAdversarial review performed 2026-05-11; re-reviewed 2026-07-13 for the CEL/1.0 migration. Walked checklist items 1-10. Identified concerns:\n  1. Impersonation: state_preconditions reference the license_registry aggregate but submit_application has no auth_preconditions because the carrier is by definition the principal — KERI signature on the outbound exn establishes identity. Acceptable.\n  2. Credential revocation timing: the on_license_revoked reaction folds revocation events; the my_active_licenses projection's delete-on-license_revoked handler excludes revoked licenses. Acceptable.\n  3. Concurrent commands: two submit_application commands for the same jurisdiction would both pass the precondition at command time if state were stale; the aggregate invariant catches the resulting duplicate. The loser's UI experience is undefined and worth surfacing.\n  4. Missed events: my_active_licenses now folds via explicit upsert/delete handlers (idempotent by construction). Acceptable.\n  5. Counterparty bad behavior: step_await_decision has time_bound P90D and expected_inbound covers both grant and explicit denial. Acceptable.\n  6. Compromised actor keys: KERI rotation semantics apply; aggregate respects key state at command time. Acceptable for licensing.\n  7. Schema versioning: not exercised in this micro-app (no exported credentials).\n  8. Convention divergence: workflow id deviation documented above.\n  9. Idempotency under network retry: this template has no idempotency_key_expression (field removed from the spec); the runtime dedups on the exn message's SAID instead.\n  10. Permission escalation: not exercised (no exported credentials).\n\nOpen risks: the aggregate's license_granted fold reducer flips EVERY pending application whose jurisdiction matches the grant to status 'granted' in one step (the aggregate has no application_id concept, so jurisdiction + status == 'pending' is the entire correlation key — this is not a tie-break that might pick a wrong row, it is a bulk update of all matching rows). With two simultaneous pending applications for the same jurisdiction (already discouraged in practice by no_active_license_for_jurisdiction, but not prevented by any application-level uniqueness rule), one grant would mark both applications granted. license_revoked has the narrower analog via its license_said match. An application_id on the payload schema (and in the fold's correlation) is the fix; deferred to a future revision. The three CEL expressions inherited from the pre-migration best-effort authoring (no_active_license_for_jurisdiction, no_duplicate_active_license_per_jurisdiction, license_terms_acceptable) remain otherwise unreviewed beyond this migration's syntax/idiom correction.",
  "compatibility_hints": {
    "compatible_with": [],
    "incompatible_with": []
  }
}
